{
  "id": "S2a",
  "mip": {
    "commit": "b147c627e1bb15b5d15cc73cf30c2a36afd34dbb",
    "testId": "S2"
  },
  "normative": true,
  "description": "Latest value wins: name \"Alpha\", symbol \"ALP\", decimals 2, standards \"mip-0004\" as four events (blocks 1-2), then an event with only name = \"Beta\" (block 3): only name changes; \"Alpha\" is not current.",
  "steps": [
    {
      "op": "apply",
      "network": "testnet-a",
      "block": 1,
      "tx": 0,
      "event": 0,
      "contractAddress": "aaaaaaaaaaaaaaaaaaaaaaaaaaaaaaaaaaaaaaaaaaaaaaaaaaaaaaaaaaaaaaaa",
      "type": "Misc",
      "name_hex": "6d69702d303031383a746f6b656e2d6d657461646174615b76315d0000000000",
      "payload_hex": "111111111111111111111111111111111111111111111111111111111111111103046e616d650105416c70686100000000000000000000000000000000000000000000000000000000000000000000000000000000000000000000000000000000000000000000000000000000000000000000000000000000000000000000000000000000000000000000000000000000000000000000000000000000000000000000000000000000000000000000000000000000000000000000000000000000000000000000000000000000000000000000000000000000000000000000000000000000000000000000000000000000000000000000000000000000000000"
    },
    {
      "op": "apply",
      "network": "testnet-a",
      "block": 1,
      "tx": 0,
      "event": 1,
      "contractAddress": "aaaaaaaaaaaaaaaaaaaaaaaaaaaaaaaaaaaaaaaaaaaaaaaaaaaaaaaaaaaaaaaa",
      "type": "Misc",
      "name_hex": "6d69702d303031383a746f6b656e2d6d657461646174615b76315d0000000000",
      "payload_hex": "1111111111111111111111111111111111111111111111111111111111111111030673796d626f6c0103414c5000000000000000000000000000000000000000000000000000000000000000000000000000000000000000000000000000000000000000000000000000000000000000000000000000000000000000000000000000000000000000000000000000000000000000000000000000000000000000000000000000000000000000000000000000000000000000000000000000000000000000000000000000000000000000000000000000000000000000000000000000000000000000000000000000000000000000000000000000000000000000"
    },
    {
      "op": "apply",
      "network": "testnet-a",
      "block": 1,
      "tx": 1,
      "event": 0,
      "contractAddress": "aaaaaaaaaaaaaaaaaaaaaaaaaaaaaaaaaaaaaaaaaaaaaaaaaaaaaaaaaaaaaaaa",
      "type": "Misc",
      "name_hex": "6d69702d303031383a746f6b656e2d6d657461646174615b76315d0000000000",
      "payload_hex": "11111111111111111111111111111111111111111111111111111111111111110308646563696d616c7302010200000000000000000000000000000000000000000000000000000000000000000000000000000000000000000000000000000000000000000000000000000000000000000000000000000000000000000000000000000000000000000000000000000000000000000000000000000000000000000000000000000000000000000000000000000000000000000000000000000000000000000000000000000000000000000000000000000000000000000000000000000000000000000000000000000000000000000000000000000000000000"
    },
    {
      "op": "apply",
      "network": "testnet-a",
      "block": 2,
      "tx": 0,
      "event": 0,
      "contractAddress": "aaaaaaaaaaaaaaaaaaaaaaaaaaaaaaaaaaaaaaaaaaaaaaaaaaaaaaaaaaaaaaaa",
      "type": "Misc",
      "name_hex": "6d69702d303031383a746f6b656e2d6d657461646174615b76315d0000000000",
      "payload_hex": "111111111111111111111111111111111111111111111111111111111111111103097374616e646172647301086d69702d303030340000000000000000000000000000000000000000000000000000000000000000000000000000000000000000000000000000000000000000000000000000000000000000000000000000000000000000000000000000000000000000000000000000000000000000000000000000000000000000000000000000000000000000000000000000000000000000000000000000000000000000000000000000000000000000000000000000000000000000000000000000000000000000000000000000000000000000000000"
    },
    {
      "op": "apply",
      "network": "testnet-a",
      "block": 3,
      "tx": 0,
      "event": 0,
      "contractAddress": "aaaaaaaaaaaaaaaaaaaaaaaaaaaaaaaaaaaaaaaaaaaaaaaaaaaaaaaaaaaaaaaa",
      "type": "Misc",
      "name_hex": "6d69702d303031383a746f6b656e2d6d657461646174615b76315d0000000000",
      "payload_hex": "111111111111111111111111111111111111111111111111111111111111111103046e616d650104426574610000000000000000000000000000000000000000000000000000000000000000000000000000000000000000000000000000000000000000000000000000000000000000000000000000000000000000000000000000000000000000000000000000000000000000000000000000000000000000000000000000000000000000000000000000000000000000000000000000000000000000000000000000000000000000000000000000000000000000000000000000000000000000000000000000000000000000000000000000000000000000"
    }
  ],
  "expect": {
    "identities": [
      {
        "network": "testnet-a",
        "contractAddress": "aaaaaaaaaaaaaaaaaaaaaaaaaaaaaaaaaaaaaaaaaaaaaaaaaaaaaaaaaaaaaaaa",
        "domainSep": "1111111111111111111111111111111111111111111111111111111111111111",
        "kind": 3,
        "visible": true,
        "fields": {
          "6e616d65": {
            "key_text": "name",
            "valType": 1,
            "value_hex": "42657461",
            "value_text": "Beta",
            "usable": true
          },
          "73796d626f6c": {
            "key_text": "symbol",
            "valType": 1,
            "value_hex": "414c50",
            "value_text": "ALP",
            "usable": true
          },
          "646563696d616c73": {
            "key_text": "decimals",
            "valType": 2,
            "value_hex": "02",
            "usable": true
          },
          "7374616e6461726473": {
            "key_text": "standards",
            "valType": 1,
            "value_hex": "6d69702d30303034",
            "value_text": "mip-0004",
            "usable": true
          }
        }
      }
    ]
  }
}
