{
  "id": "S7b",
  "mip": {
    "commit": "274a84f221bcfc17e4b73e2c8b32fd8c028ea092",
    "testId": "S7"
  },
  "normative": true,
  "description": "Independent events: in one transaction, event 0 sets name = \"Good\" and event 1 is malformed (name = \"Evil\", then a valType-6 record): event 0 stays applied, event 1 is rejected entirely.",
  "steps": [
    {
      "op": "apply",
      "network": "testnet-a",
      "block": 1,
      "tx": 0,
      "event": 0,
      "contractAddress": "aaaaaaaaaaaaaaaaaaaaaaaaaaaaaaaaaaaaaaaaaaaaaaaaaaaaaaaaaaaaaaaa",
      "type": "Misc",
      "name_hex": "6d69702d303031383a746f6b656e2d6d657461646174615b76315d0000000000",
      "payload_hex": "111111111111111111111111111111111111111111111111111111111111111103046e616d650104476f6f640000000000000000000000000000000000000000000000000000000000000000000000000000000000000000000000000000000000000000000000000000000000000000000000000000000000000000000000000000000000000000000000000000000000000000000000000000000000000000000000000000000000000000000000000000000000000000000000000000000000000000000000000000000000000000000000000000000000000000000000000000000000000000000000000000000000000000000000000000000000000000"
    },
    {
      "op": "apply",
      "network": "testnet-a",
      "block": 1,
      "tx": 0,
      "event": 1,
      "contractAddress": "aaaaaaaaaaaaaaaaaaaaaaaaaaaaaaaaaaaaaaaaaaaaaaaaaaaaaaaaaaaaaaaa",
      "type": "Misc",
      "name_hex": "6d69702d303031383a746f6b656e2d6d657461646174615b76315d0000000000",
      "payload_hex": "111111111111111111111111111111111111111111111111111111111111111103046e616d6501044576696c0178060000000000000000000000000000000000000000000000000000000000000000000000000000000000000000000000000000000000000000000000000000000000000000000000000000000000000000000000000000000000000000000000000000000000000000000000000000000000000000000000000000000000000000000000000000000000000000000000000000000000000000000000000000000000000000000000000000000000000000000000000000000000000000000000000000000000000000000000000000000000"
    }
  ],
  "expect": {
    "identities": [
      {
        "network": "testnet-a",
        "contractAddress": "aaaaaaaaaaaaaaaaaaaaaaaaaaaaaaaaaaaaaaaaaaaaaaaaaaaaaaaaaaaaaaaa",
        "domainSep": "1111111111111111111111111111111111111111111111111111111111111111",
        "kind": 3,
        "visible": true,
        "fields": {
          "6e616d65": {
            "key_text": "name",
            "valType": 1,
            "value_hex": "476f6f64",
            "value_text": "Good",
            "usable": true
          }
        }
      }
    ]
  }
}
