{
  "id": "INF-STD-6",
  "mip": {
    "commit": "78ecbb4b1ba57371e84fe45f705991ab7b996a61",
    "testId": "INF-STANDARDS"
  },
  "normative": false,
  "description": "standards = \"mip-0004 x<U+00A0>y\" (no-break space, bytes c2 a0: no byte in 0x00-0x20/0x7f): usable.",
  "basis": "MIP \"Common fields\": standards = identifiers separated by single spaces; identifier non-empty, no byte in 0x00-0x20 or 0x7f; empty = no standards claimed; malformed = unusable. The byte rule allows other Unicode spaces and controls (U+00A0, U+0085); the project withdrew the note asking the MIP to say so (N6, out of scope).",
  "steps": [
    {
      "op": "apply",
      "network": "testnet-a",
      "block": 1,
      "tx": 0,
      "event": 0,
      "contractAddress": "aaaaaaaaaaaaaaaaaaaaaaaaaaaaaaaaaaaaaaaaaaaaaaaaaaaaaaaaaaaaaaaa",
      "type": "Misc",
      "name_hex": "6d69702d303031383a746f6b656e2d6d657461646174615b76315d0000000000",
      "payload_hex": "111111111111111111111111111111111111111111111111111111111111111103097374616e6461726473010d6d69702d303030342078c2a079000000000000000000000000000000000000000000000000000000000000000000000000000000000000000000000000000000000000000000000000000000000000000000000000000000000000000000000000000000000000000000000000000000000000000000000000000000000000000000000000000000000000000000000000000000000000000000000000000000000000000000000000000000000000000000000000000000000000000000000000000000000000000000000000000000000000"
    }
  ],
  "expect": {
    "identities": [
      {
        "network": "testnet-a",
        "contractAddress": "aaaaaaaaaaaaaaaaaaaaaaaaaaaaaaaaaaaaaaaaaaaaaaaaaaaaaaaaaaaaaaaa",
        "domainSep": "1111111111111111111111111111111111111111111111111111111111111111",
        "kind": 3,
        "visible": true,
        "fields": {
          "7374616e6461726473": {
            "key_text": "standards",
            "valType": 1,
            "value_hex": "6d69702d303030342078c2a079",
            "value_text": "mip-0004 x y",
            "usable": true
          }
        }
      }
    ]
  }
}
