{
  "id": "INF-STD-4",
  "mip": {
    "commit": "274a84f221bcfc17e4b73e2c8b32fd8c028ea092",
    "testId": "INF-STANDARDS"
  },
  "normative": false,
  "description": "standards = \"\" (empty: no standards claimed, not malformed): usable.",
  "basis": "MIP \"Common fields\": standards = identifiers separated by single spaces; identifier non-empty, no byte in 0x00-0x20 or 0x7f; empty = no standards claimed; malformed = unusable.",
  "steps": [
    {
      "op": "apply",
      "network": "testnet-a",
      "block": 1,
      "tx": 0,
      "event": 0,
      "contractAddress": "aaaaaaaaaaaaaaaaaaaaaaaaaaaaaaaaaaaaaaaaaaaaaaaaaaaaaaaaaaaaaaaa",
      "type": "Misc",
      "name_hex": "6d69702d303031383a746f6b656e2d6d657461646174615b76315d0000000000",
      "payload_hex": "111111111111111111111111111111111111111111111111111111111111111103097374616e6461726473010000000000000000000000000000000000000000000000000000000000000000000000000000000000000000000000000000000000000000000000000000000000000000000000000000000000000000000000000000000000000000000000000000000000000000000000000000000000000000000000000000000000000000000000000000000000000000000000000000000000000000000000000000000000000000000000000000000000000000000000000000000000000000000000000000000000000000000000000000000000000000"
    }
  ],
  "expect": {
    "identities": [
      {
        "network": "testnet-a",
        "contractAddress": "aaaaaaaaaaaaaaaaaaaaaaaaaaaaaaaaaaaaaaaaaaaaaaaaaaaaaaaaaaaaaaaa",
        "domainSep": "1111111111111111111111111111111111111111111111111111111111111111",
        "kind": 3,
        "visible": true,
        "fields": {
          "7374616e6461726473": {
            "key_text": "standards",
            "valType": 1,
            "value_hex": "",
            "value_text": "",
            "usable": true
          }
        }
      }
    ]
  }
}
