{
  "id": "S5b",
  "mip": {
    "commit": "b147c627e1bb15b5d15cc73cf30c2a36afd34dbb",
    "testId": "S5"
  },
  "normative": true,
  "description": "Unusable fields: after decimals = 6 (type 2), a type-1 decimals of \"6\" is accepted and makes decimals unusable, with no fallback to 6.",
  "steps": [
    {
      "op": "apply",
      "network": "testnet-a",
      "block": 1,
      "tx": 0,
      "event": 0,
      "contractAddress": "aaaaaaaaaaaaaaaaaaaaaaaaaaaaaaaaaaaaaaaaaaaaaaaaaaaaaaaaaaaaaaaa",
      "type": "Misc",
      "name_hex": "6d69702d303031383a746f6b656e2d6d657461646174615b76315d0000000000",
      "payload_hex": "111111111111111111111111111111111111111111111111111111111111111103046e616d65010441636d6508646563696d616c730201060000000000000000000000000000000000000000000000000000000000000000000000000000000000000000000000000000000000000000000000000000000000000000000000000000000000000000000000000000000000000000000000000000000000000000000000000000000000000000000000000000000000000000000000000000000000000000000000000000000000000000000000000000000000000000000000000000000000000000000000000000000000000000000000000000000000000000"
    },
    {
      "op": "apply",
      "network": "testnet-a",
      "block": 2,
      "tx": 0,
      "event": 0,
      "contractAddress": "aaaaaaaaaaaaaaaaaaaaaaaaaaaaaaaaaaaaaaaaaaaaaaaaaaaaaaaaaaaaaaaa",
      "type": "Misc",
      "name_hex": "6d69702d303031383a746f6b656e2d6d657461646174615b76315d0000000000",
      "payload_hex": "11111111111111111111111111111111111111111111111111111111111111110308646563696d616c7301013600000000000000000000000000000000000000000000000000000000000000000000000000000000000000000000000000000000000000000000000000000000000000000000000000000000000000000000000000000000000000000000000000000000000000000000000000000000000000000000000000000000000000000000000000000000000000000000000000000000000000000000000000000000000000000000000000000000000000000000000000000000000000000000000000000000000000000000000000000000000000"
    }
  ],
  "expect": {
    "identities": [
      {
        "network": "testnet-a",
        "contractAddress": "aaaaaaaaaaaaaaaaaaaaaaaaaaaaaaaaaaaaaaaaaaaaaaaaaaaaaaaaaaaaaaaa",
        "domainSep": "1111111111111111111111111111111111111111111111111111111111111111",
        "kind": 3,
        "visible": true,
        "fields": {
          "6e616d65": {
            "key_text": "name",
            "valType": 1,
            "value_hex": "41636d65",
            "value_text": "Acme",
            "usable": true
          },
          "646563696d616c73": {
            "key_text": "decimals",
            "valType": 1,
            "value_hex": "36",
            "value_text": "6",
            "usable": false
          }
        }
      }
    ]
  }
}
