{
  "id": "INF-STD-5",
  "mip": {
    "commit": "b147c627e1bb15b5d15cc73cf30c2a36afd34dbb",
    "testId": "INF-STANDARDS"
  },
  "normative": false,
  "description": "standards = \"mip-0004 mip-0004 erc-20\" (duplicates carry no meaning): usable.",
  "basis": "MIP \"Common fields\": standards = identifiers separated by single spaces; identifier non-empty, no byte in 0x00-0x20 or 0x7f; empty = no standards claimed; malformed = unusable.",
  "steps": [
    {
      "op": "apply",
      "network": "testnet-a",
      "block": 1,
      "tx": 0,
      "event": 0,
      "contractAddress": "aaaaaaaaaaaaaaaaaaaaaaaaaaaaaaaaaaaaaaaaaaaaaaaaaaaaaaaaaaaaaaaa",
      "type": "Misc",
      "name_hex": "6d69702d303031383a746f6b656e2d6d657461646174615b76315d0000000000",
      "payload_hex": "111111111111111111111111111111111111111111111111111111111111111103097374616e646172647301186d69702d30303034206d69702d30303034206572632d323000000000000000000000000000000000000000000000000000000000000000000000000000000000000000000000000000000000000000000000000000000000000000000000000000000000000000000000000000000000000000000000000000000000000000000000000000000000000000000000000000000000000000000000000000000000000000000000000000000000000000000000000000000000000000000000000000000000000000000000000000000000000000"
    }
  ],
  "expect": {
    "identities": [
      {
        "network": "testnet-a",
        "contractAddress": "aaaaaaaaaaaaaaaaaaaaaaaaaaaaaaaaaaaaaaaaaaaaaaaaaaaaaaaaaaaaaaaa",
        "domainSep": "1111111111111111111111111111111111111111111111111111111111111111",
        "kind": 3,
        "visible": true,
        "fields": {
          "7374616e6461726473": {
            "key_text": "standards",
            "valType": 1,
            "value_hex": "6d69702d30303034206d69702d30303034206572632d3230",
            "value_text": "mip-0004 mip-0004 erc-20",
            "usable": true
          }
        }
      }
    ]
  }
}
