{
  "id": "INF-COMMON-1",
  "mip": {
    "commit": "274a84f221bcfc17e4b73e2c8b32fd8c028ea092",
    "testId": "INF-COMMON"
  },
  "normative": false,
  "description": "Common fields with the wrong type or form: name as bytes (type 0), symbol empty, decimals as bytes (type 0) — all unusable; the event is accepted.",
  "basis": "MIP \"Common fields\": name/symbol = UTF-8 string, not empty; decimals = unsigned integer; a field without that type or form is unusable.",
  "steps": [
    {
      "op": "apply",
      "network": "testnet-a",
      "block": 1,
      "tx": 0,
      "event": 0,
      "contractAddress": "aaaaaaaaaaaaaaaaaaaaaaaaaaaaaaaaaaaaaaaaaaaaaaaaaaaaaaaaaaaaaaaa",
      "type": "Misc",
      "name_hex": "6d69702d303031383a746f6b656e2d6d657461646174615b76315d0000000000",
      "payload_hex": "111111111111111111111111111111111111111111111111111111111111111103046e616d65000441636d650673796d626f6c010008646563696d616c730001060000000000000000000000000000000000000000000000000000000000000000000000000000000000000000000000000000000000000000000000000000000000000000000000000000000000000000000000000000000000000000000000000000000000000000000000000000000000000000000000000000000000000000000000000000000000000000000000000000000000000000000000000000000000000000000000000000000000000000000000000000000000000000000000"
    }
  ],
  "expect": {
    "identities": [
      {
        "network": "testnet-a",
        "contractAddress": "aaaaaaaaaaaaaaaaaaaaaaaaaaaaaaaaaaaaaaaaaaaaaaaaaaaaaaaaaaaaaaaa",
        "domainSep": "1111111111111111111111111111111111111111111111111111111111111111",
        "kind": 3,
        "visible": true,
        "fields": {
          "6e616d65": {
            "key_text": "name",
            "valType": 0,
            "value_hex": "41636d65",
            "usable": false
          },
          "73796d626f6c": {
            "key_text": "symbol",
            "valType": 1,
            "value_hex": "",
            "value_text": "",
            "usable": false
          },
          "646563696d616c73": {
            "key_text": "decimals",
            "valType": 0,
            "value_hex": "06",
            "usable": false
          }
        }
      }
    ]
  }
}
